[
    {
        "id": "korvus_technology",
        "name": "Korvus Technology",
        "aliases": [
            "Korvus",
            "Korvus Tech"
        ],
        "country": "United Kingdom",
        "active": true,
        "product_categories": [
            "thin film deposition systems",
            "PVD systems",
            "vacuum deposition equipment",
            "deposition sources",
            "laboratory research tools"
        ],
        "products": [
            "HEX Series PVD systems",
            "HEX Mini",
            "HEX-L",
            "HEX-XL",
            "FISSION Magnetron Sputtering Source",
            "ORCA Low Temperature Evaporation",
            "TAU Electron Beam Evaporation",
            "TES Thermal Boat Evaporation"
        ],
        "industries_served": [
            "material science",
            "semiconductors",
            "photovoltaics",
            "optics",
            "electronics",
            "nanomaterials",
            "sensor applications",
            "academic R&D"
        ],
        "embedding_text": "Supply, procurement, and installation of modular PVD coating systems including magnetron sputtering, thermal evaporation, and electron beam evaporation systems used in research and laboratory environments.\nUsed in universities and R&D labs for thin film deposition, materials research, nanotechnology, and experimental coating development.\nAlso referred to as PVD coating system, thin film deposition unit, sputtering system, or vacuum deposition system for research applications.\nSpecialized in compact, modular, and reconfigurable PVD systems for academic and research use.",
        "keywords": [
            "PVD",
            "thin film deposition",
            "magnetron sputtering",
            "electron beam evaporation",
            "thermal evaporation",
            "vacuum system",
            "HEX series",
            "material research"
        ],
        "concepts": [
            "thin_film_deposition",
            "pvd",
            "sputtering",
            "magnetron_sputtering",
            "electron_beam_evaporation",
            "thermal_evaporation",
            "vacuum_system",
            "materials_research"
        ],
        "negative_keywords": [],
        "service_keywords": [
            "AMC",
            "annual maintenance",
            "maintenance",
            "repair",
            "spares",
            "installation",
            "commissioning",
            "calibration",
            "replacement"
        ],
        "website": "https://korvustech.com/",
        "source_links": [
            "https://korvustech.com/pvd-systems/",
            "https://korvustech.com/highly-modular-pvd-system/",
            "https://korvustech.com/magnetron-sputtering-system/",
            "https://korvustech.com/organic-thermal-evaporation/",
            "https://korvustech.com/pvd-thermal-evaporation/",
            "https://korvustech.com/thermal-deposition/",
            "https://korvustech.com/wp-content/uploads/2025/01/Korvus-2pp-TAU.pdf"
        ],
        "profile_version": "1.2",
        "profile_last_updated": "2026-10-22"
    },
    {
        "id": "parteq",
        "name": "ParteQ GmbH",
        "country": "Germany",
        "active": true,
        "product_categories": [
            "nanoparticle synthesis systems",
            "aerosol measurement instruments",
            "particle engineering systems",
            "CVD-based powder functionalization systems"
        ],
        "products": [
            "flame spray pyrolysis nanoparticle synthesis systems",
            "bench-top nanoparticle synthesis units",
            "aerosol and particle measurement instruments",
            "nanopowder collection and filtration systems",
            "pilot-scale particle engineering systems"
        ],
        "industries_served": [
            "nanotechnology research",
            "materials science",
            "energy storage and batteries",
            "catalysis",
            "air quality and fine-dust monitoring",
            "advanced academic R&D"
        ],
        "embedding_text": "ParteQ GmbH develops advanced particle engineering systems including nanoparticle synthesis units, aerosol measurement instruments, and powder functionalization technologies using processes like flame spray pyrolysis and chemical vapor deposition. Their systems enable precise control over nano- and micro-scale particle structures and are used in advanced materials research, energy storage, catalysis, and nanotechnology labs. These solutions are highly relevant for tenders involving nanomaterial synthesis, aerosol science, and pilot-scale material development infrastructure where specialized expertise and low competition environments are typical.",
        "keywords": [
            "nanoparticle synthesis",
            "flame spray pyrolysis",
            "aerosol measurement",
            "particle engineering",
            "nanopowder",
            "CVD functionalization",
            "materials research",
            "nano fabrication"
        ],
        "concepts": [
            "nanoparticle_synthesis",
            "flame_spray_pyrolysis",
            "aerosol_measurement",
            "particle_engineering",
            "nanopowder",
            "cvd_functionalization",
            "materials_research"
        ],
        "negative_keywords": [],
        "service_keywords": [
            "AMC",
            "annual maintenance",
            "maintenance",
            "repair",
            "spares",
            "installation",
            "commissioning",
            "calibration",
            "replacement"
        ],
        "website": "https://parteq.net",
        "source_links": [
            "https://parteq.net/en/products/",
            "https://parteq.net/en/products/nanopowder-synthesis/flammensynthese/",
            "https://parteq.net/en/products/nanopowder-synthesis/",
            "https://parteq.net/en/products/aerosolmesstechnik/",
            "https://parteq.net/en/products/aerosolmesstechnik/nanoparticle-measurement-systems/",
            "https://parteq.net/en/products/aerosolmesstechnik/fine-dust-monitoring/",
            "https://parteq.net/en/products/aerosolmesstechnik/fine-dust-monitoring/aq-guard.html",
            "https://parteq.net/en/services-in-aerosol-technology/forschungsdienstleistungen.html",
            "https://parteq.net/produkte/partikelstrukturierung-und-funktionalisierung/",
            "https://parteq.net/en/"
        ],
        "profile_version": "1.3",
        "profile_last_updated": "2026-10-22"
    },
    {
        "id": "pg_instruments",
        "name": "P.G. Instruments Ltd.",
        "country": "UK",
        "active": true,
        "product_categories": [
            "laboratory analytical instrumentation",
            "ICP-OES spectrometers",
            "UV-Vis spectrophotometers",
            "atomic absorption spectrometers",
            "atomic fluorescence spectrometers",
            "flame photometers",
            "laboratory water purification systems"
        ],
        "products": [
            "ICP-OES spectrometers",
            "atomic absorption spectrometers (AAS)",
            "UV-Vis spectrophotometers",
            "atomic fluorescence spectrometers",
            "flame photometers",
            "water purification systems"
        ],
        "industries_served": [
            "environmental monitoring and control",
            "pharmaceutical production and quality control",
            "food and beverage quality control and monitoring",
            "oil and gas production and monitoring",
            "iron and steel quality control",
            "geology studies and metallurgy",
            "water purity testing",
            "biotechnology and life sciences"
        ],
        "embedding_text": "P.G. Instruments Limited supplies laboratory analytical instrumentation with a focus on spectroscopy. Its published range includes ICP-OES, UV-Vis spectroscopy, atomic absorption spectroscopy, atomic fluorescence spectroscopy, flame photometry, and water purification. The manufacturer lists applications in environmental monitoring and control, pharmaceutical production and quality control, food and beverage quality control, oil and gas production and monitoring, iron and steel quality control, geology and metallurgy, water purity, and biotechnology and life sciences. Confirm the required analytical method, model specifications, certifications, and support against the tender and official product evidence.",
        "keywords": [
            "ICP-OES",
            "UV-Vis spectroscopy",
            "atomic absorption",
            "atomic fluorescence",
            "flame photometry",
            "flame photometer",
            "spectrophotometer",
            "water purification",
            "analytical instrumentation"
        ],
        "concepts": [
            "icp_oes",
            "uv_vis_spectroscopy",
            "atomic_absorption_spectroscopy",
            "atomic_fluorescence_spectroscopy",
            "flame_photometry",
            "water_purification",
            "analytical_instrumentation"
        ],
        "negative_keywords": [],
        "service_keywords": [
            "AMC",
            "annual maintenance",
            "maintenance",
            "repair",
            "spares",
            "installation",
            "commissioning",
            "calibration",
            "replacement"
        ],
        "website": "https://www.pginstruments.com/",
        "source_links": [
            "https://www.pginstruments.com/products/",
            "https://www.pginstruments.com/industries/",
            "https://www.pginstruments.com/product/wp750-series/",
            "https://www.pginstruments.com/product/aa500f/",
            "https://www.pginstruments.com/product/fp910-flame-photometer/",